{
  "schema": "fm-today-enrolment.v1",
  "enrol_id": "enr_7Hq2mV0cXbN4aLpR9sT1wY",
  "credential_id": "MHZg0dd0my02mHA9zuS0rY9crbM",
  "client_data_json": "eyJ0eXBlIjoid2ViYXV0aG4uY3JlYXRlIiwiY2hhbGxlbmdlIjoiamt6dUNJT1RlS09kMmxVckFqZ2UtSGkxOExUZFJobVZ0cE9fMmdEQzlDOCIsIm9yaWdpbiI6Imh0dHBzOi8vcmVsYXktYXBpLm1tZWcudXMiLCJjcm9zc09yaWdpbiI6ZmFsc2V9",
  "attestation_object": "o2NmbXRkbm9uZWdhdHRTdG10oGhhdXRoRGF0YViYWmRW4yO0zR4QlQ2_b41F0rV2eEJUD688VfXUd27wBYVdAAAAAAAAAAAAAAAAAAAAAAAAAAAAFDB2YNHXdJstNphwPc7ktK2PXK2zpQECAyYgASFYIGEh_K-kZ-1HR8u8aYJozL70GyajfAdoQQJivbzAow_DIlggTulOFCczK4vKSyRZrXlYLtwSSYItCwjSP98cZPWn-B4",
  "public_key_spki": "MFkwEwYHKoZIzj0CAQYIKoZIzj0DAQcDQgAEYSH8r6Rn7UdHy7xpgmjMvvQbJqN8B2hBAmK9vMCjD8NO6U4UJzMri8pLJFmteVgu3BJJgi0LCNI_3xxk9af4Hg",
  "public_key_alg": -7,
  "transports": [
    "hybrid",
    "internal"
  ],
  "enrolled_at": "2026-09-28T14:12:40Z",
  "person": "user_2captain",
  "device": "mac-studio"
}
